{
  "$schema": "https://json-schema.org/draft/2020-12/schema",
  "$id": "https://github.com/SAeedajf/ui-ux-skill/blob/main/schemas/phase-05c-report.schema.json",
  "title": "UI/UX Pro Phase 05-C Runtime Acceptance Report",
  "type": "object",
  "additionalProperties": false,
  "required": ["phase", "status", "base_commit", "branch", "codex_cli", "model", "install", "positive", "negative", "fixture", "repair", "browser", "duplicate_skills", "rollback", "ci", "model_calls", "evidence", "open_gates"],
  "properties": {
    "phase": {"const": "05-C"},
    "status": {"enum": ["PASS", "PARTIAL", "BLOCKED", "FAIL"]},
    "base_commit": {"type": "string", "pattern": "^[0-9a-f]{40}$"},
    "branch": {"const": "codex/ui-ux-plugin-phase-05c"},
    "pull_request": {"type": ["string", "null"], "format": "uri"},
    "codex_cli": {"type": "object", "required": ["version", "path", "auth"], "properties": {"version": {"const": "0.153.4"}, "path": {"type": "string"}, "auth": {"const": "ChatGPT"}}},
    "model": {"type": "object", "required": ["requested", "actual_identity", "default_unchanged"], "properties": {"requested": {"const": "gpt-5.6-terra"}, "actual_identity": {"const": "UNVERIFIED"}, "default_unchanged": {"const": true}}},
    "install": {"type": "object", "required": ["status", "version", "skill_count", "before_plugin_count", "before_marketplace_count"], "properties": {"status": {"const": "PASS"}, "version": {"const": "0.1.0"}, "skill_count": {"const": 15}, "before_plugin_count": {"const": 33}, "before_marketplace_count": {"const": 3}}},
    "positive": {"type": "object", "required": ["status", "turn_completed", "plugin_skill_read", "legacy_skills_read"], "properties": {"status": {"const": "FAIL"}, "turn_completed": {"const": true}, "plugin_skill_read": {"const": false}, "legacy_skills_read": {"type": "array", "minItems": 1, "items": {"type": "string"}}}},
    "negative": {"type": "object", "required": ["status", "turn_completed", "uiux_skill_read", "files_created"], "properties": {"status": {"const": "PASS"}, "turn_completed": {"const": true}, "uiux_skill_read": {"const": false}, "files_created": {"const": false}}},
    "fixture": {"type": "object", "required": ["baseline_status", "tests", "failed", "after_status"], "properties": {"baseline_status": {"const": "EXPECTED_FAILURES"}, "tests": {"const": 5}, "failed": {"const": 5}, "after_status": {"const": "NOT_RUN"}}},
    "repair": {"type": "object", "required": ["status", "diff_created", "reason"], "properties": {"status": {"const": "BLOCKED"}, "diff_created": {"const": false}, "reason": {"type": "string", "minLength": 1}}},
    "browser": {"const": "NOT_RUN"},
    "duplicate_skills": {"type": "object", "required": ["legacy_count", "legacy_changed", "plugin_precedence_proven"], "properties": {"legacy_count": {"const": 8}, "legacy_changed": {"const": false}, "plugin_precedence_proven": {"const": false}}},
    "rollback": {"type": "object", "required": ["remove_commands_succeeded", "cache_absent", "inventory_equality"], "properties": {"remove_commands_succeeded": {"const": true}, "cache_absent": {"const": true}, "inventory_equality": {"const": "UNVERIFIED"}}},
    "ci": {"type": "object", "required": ["status", "run_url"], "properties": {"status": {"enum": ["PENDING", "PASS", "FAIL"]}, "run_url": {"type": ["string", "null"], "format": "uri"}, "output_commit": {"type": ["string", "null"], "pattern": "^[0-9a-f]{40}$"}}},
    "model_calls": {"type": "object", "required": ["attempted", "completed", "repair_limit_failure", "retry"], "properties": {"attempted": {"const": 3}, "completed": {"const": 2}, "repair_limit_failure": {"const": true}, "retry": {"const": 0}}},
    "evidence": {"type": "array", "minItems": 1, "items": {"type": "string"}},
    "open_gates": {"type": "array", "minItems": 1, "items": {"type": "string"}}
  }
}
